,smart_institution2,count
1226,Physiotherapy Dept. Health Sciences,1
1227,Ochsner Lsu Health Sciences Center,1
1228,Ochsner Lsu Health Shreveport,1
1229,Ohio State University Wexner Medical Center And James Comprehensive Center,1
1230,Ohio University,1
1231,Ohio University Heritage College Of Osteopathic Medicine,1
1232,Ohiohealth/Grant Medical Center,1
1233,Okayama University Graduate School Of Medicine,1
1234,Okinawa Chubu Hospital,1
1235,Oklahoma Children'S Hospital,1
1236,Ontario Telemedicine Network (Otn),1
1237,Oregon Health & Science University,1
1238,Osaka Saiseikai-Noe Hospital,1
1239,Osaka University,1
1240,1Stroger Hospital Of Cook County,1
1241,Pacific Northwest University Of Health Sciences,1
1242,Palmetto General Hospital,1
1243,Palmetto General Hospital- Center For Advanced Surgical Oncology,1
1244,Panzi Hospital,1
1245,Partners In Health Mexico,1
1246,Penn State Children'S Hospital,1
1247,Penn State Health Hershey Medical Center,1
1248,Penn State Health Milton S Hershey Medical Center,1
1249,Penn State Milton S. Hershey Medical Center,1
1250,Pennington Biomedical Research Center,1
1251,Pennstate Health Milton S. Hershey Medical Center,1
1252,Pennsylvania State University College Of Medicine,1
1253,Perelman School Of Medicine At University Of Pennsylvania,1
1254,Phoenix Children'S Hospital,1
1255,Physicians For Peace,1
1256,Rutgers Health New Jersey Medical School,1
1257,Rutgers New Jersey Medical School/ University Hospital,1
1258,Rutgers New Jersey Medical School/University Hospital,1
1259,Simpson Querrey Institute For Bionanotechnology,1
1260,Sky Ridge Medical Center,1
1261,Sociedad Quirrgica S.C. At The American British Cowdray Medical Center,1
1262,Socios En Salud,1
1263,Soroti Regional Referral Hospital,1
1264,South Central Regional Medical Center,1
1265,Southside Hospital / Northwell Health,1
1266,Ssm Cardinal Glennon Children'S Hospital,1
1267,St Agnes Hospital,1
1268,St Jude Childrens Research Hospital,1
1269,St Luke'S University Health Network,1
1270,St. John'S University College Of Pharmacy And Health Sciences,1
1271,St. Joseph Mercy Ann Arbor,1
1272,St. Joseph'S Mercy Hospital,1
1273,St. Joseph'S University Medical Center,1
1274,St. Luke'S Hospital Plaza- Kansas City,1
1275,St. Luke'S Roosevelt Hospital Center,1
1276,St. Luke'S University Hospital,1
1277,Stanford Medicine,1
1278,Stanford School Of Medicine And Palo Alto Va Hcs,1
1279,State University Of Haiti,1
1280,Staten Island University Hospital-Northwell Health,1
1281,Steven And Alexandra Cohen Children'S Medical Center,1
1282,Stony Brook University Hospital,1
1283,Stratus Center For Medical Simulation,1
1284,Sunnybrook Health Sciences Centre,1
1285,Surgical Outcomes And Quality Improvement Center (Soqic),1
1286,Swedish Medical Center,1
1287,Sylvester Cancer Center,1
1288,Taipei Medical University - Shuang Ho Hospital,1
1289,Sinai Hospital,1
1290,Shock Trauma Center At University Of Maryland,1
1291,Rutgers Robert Wood Johnson,1
1292,Shizuoka Children'S Hospital,1
1293,Rutgers Robert Wood Johnson University Hospital,1
1294,Rutgers School Of Biomedical Sciences,1
1295,Rutgers School Of Dental Medicine,1
1296,Rutgers University  Biomedical And Health Sciences,1
1297,Rutgers University - Robert Wood Johnson Medical School,1
1298,Rutgers University-Newark,1
1299,Rutgers-Robert Wood Johnson University Hospital,1
1300,Sacramento Va Medical Center,1
1301,Saint Agnes Healthcare,1
1302,Saint Agnes Hospital Center And Cancer Institute,1
1303,Saint Boniface Hospital,1
1304,Saint Elizabeth Medical Center,1
1305,Saint Mary'S Hospital,1
1306,Samford University,1
1307,Samuel S Stratton Veteran Affairs Medical Center,1
1308,San Antonio Military Medical Center,1
1309,San Francisco General Hospital And The University Of California,1
1310,San Francisco State University,1
1311,San Jose State University,1
1312,Sanford Burnham Prebys Medical Discovery Institute,1
1313,Sapporo Ishiyama Hospital,1
1314,Sapporo Medical University Hospital,1
1315,Saveetha Medical College And Hospital,1
1316,Scripps Mercy Hospital,1
1317,Scripps Mercy Hospital Trauma Service,1
1318,Sefako Makgatho Health Sciences University,1
1319,Semmelweis University,1
1320,Shinshu Medical University,1
1321,Shinshu University Of Medicine,1
1322,Ocala Regional Medical Center,1
1323,Nyu School Of Medicine,1
1324,Johns Hopkins,1
1325,Marquette University,1
1326,Legacy Good Samaritan Medical Center,1
1327,Leiden University Medical Center,1
1328,Lincoln Medical Center,1
1329,Liver And Pancreas Transplant Center,1
1330,Louisiana State University,1
1331,Louisiana State University Health - Shreveport,1
1332,Louisiana State University Health Sciences Center- Shreveport,1
1333,Lousiana State University In Shreveport,1
1334,Loyola University Chicago,1
1335,Loyola Universtiy Medical Center,1
1336,Magee-Womens Research Institute,1
1337,Makerere University School Of Medicine,1
1338,Marin General Hospital,1
1339,Marin Health Medical Center,1
1340,Marshall Institute For Interdisciplinary Research,1
1341,Nyu Langone Hospital-Brooklyn,1
1342,Marshall University Joan C. Edwards School Of Medicine,1
1343,Marshall University School Of Medcine,1
1344,Marshfield Clinic Health Center,1
1345,Marshfield Clinic Health System,1
1346,Marshfield Medical Center,1
1347,Mary Bridge Children'S Health Center,1
1348,Massachusetts General Hospital & Harvard Medical School,1
1349,Mater Adult Brisbane Hospital,1
1350,Matola Hospital,1
1351,Matsushima Hospital,1
1352,Mayo Clinic - Rochester,1
1353,Mayo Clinic Rochester,1
1354,Mbarara University Of Science And Technology,1
1355,Mcgill University Health Centre,1
1356,Lankenau Medical Center,1
1357,Lahore General Hospital,1
1358,Lahey Hospital Medical Center,1
1359,Lahey Hospital And Medical Center,1
1360,Johns Hopkins Bayview Medical Centre,1
1361,Johns Hopkins Bloomberg School Of Public Health,1
1362,Johns Hopkins Medicine International,1
1363,Johns Hopkins School Of Medicine,1
1364,Johns Hopkins Surgery Center For Outcomes Research,1
1365,Johns Hopkins University Bloomberg School Of Public Health,1
1366,Kagoshima University,1
1367,Kampala International University Western Campus,1
1368,Kamuzu Central Hospital,1
1369,Karmanos Cancer Institute,1
1370,Kashiwa Kosei General Hospital,1
1371,Keck School Of Medicine,1
1372,Keck School Of Medicine Of The University Of Southern California,1
1373,Keio Universiry,1
1374,Kibungo Referral Hospital,1
1375,Kinan Hospita,1
1376,King Abdulaziz Medical City,1
1377,King Edward Medical University,1
1378,King Faisal Specialist Hospital And Research Center (Kfsh),1
1379,King George'S Medical University,1
1380,King University,1
1381,King'S College London School Of Medicine,1
1382,King'S Mill Hospital,1
1383,Kobe University,1
1384,Komaki Municipal Hospital,1
1385,Kravis Children'S Hospital At Mount Sinai,1
1386,Kyushu University Beppu Hospital,1
1387,Laboratory For Regenerative Tissue Repair,1
1388,Lagos University Teaching Hospital,1
1389,Mcgovern Medical School At Uthealth And Children'S Memorial Hermann,1
1390,Md Anderson Cancer Center,1
1391,Medical Center,1
1392,Nemours/Alfred I Dupont Hospital For Children,1
1393,New York Hospital Queens,1
1394,New York Institute Of Technology,1
1395,New York Presbyterian Hospital - Weill Cornell Medical College,1
1396,New York Presbyterian Hospital-Columbia,1
1397,New York Presbyterian Hospital/Weill Cornell Medicine,1
1398,New York Presbyterian/Columbia University Medical Center,1
1399,New York University Langone Health,1
1400,New York University Langone Hospital - Long Island,1
1401,New York-Presbyterian-Cornell,1
1402,Newyork-Presbyterian Hospital/Weill Cornell Medical Center,1
1403,Newyork-Presbyterian Queens,1
1404,Newyork-Presbyterian/Queens,1
1405,Niigata University,1
1406,Nkafu Policy Institute,1
1407,North Shore University Hospital,1
1408,North Shore University Hospital And Long Island Jewish Medical Center,1
1409,Northern Ontario School Of Medicine(Nosm) University,1
1410,Northwell - Staten Island University Hospital,1
1411,Northwell Health Cancer Institute At Northwell Center For Advanced Medicine,1
1412,Northwell Health North Shore/Long Island Jewish Hospital,1
1413,Northwell Health System - Long Island Jewish Medical Center,1
1414,Northwell Northshore/Long Island Jewish,1
1415,Northwestern Memorial Hospital,1
1416,Northwestern University Feinberg School Of Medicine And Ann & Robert H. Lurie Childrens Hospital Of Chicago,1
1417,Northwestern University- Feinberg School Of Medicine,1
1418,Nyc Health +Hospitals/ Elmhurst,1
1419,Nyu Langone Health,1
1420,Nyu Langone Hospital,1
1421,Nyu Langone Hospital - Long Island,1
1422,Nepal Medical College And Teaching Hospital,1
1423,Nemours Children'S Health System,1
1424,Medical College Of Georgia At Augusta University,1
1425,Nemours Children'S Health,1
1426,Medical College Of Wisconsin & Froedert Hospital,1
1427,Medical College Of Wisconsin Affiliated Hospitals,1
1428,Medstar Georgetown University Hospital/Washington Hospital Center,1
1429,Medstar-Georgetown University Medical Center,1
1430,Memorial University Medical Center,1
1431,Memorial University Medical Center-Mercer University School Of Medicine,1
1432,Mercy Medical Center,1
1433,Mercyone Des Moines,1
1434,Mgh Institute Of Health Professions,1
1435,Mgh Institute Of Technological Assessment,1
1436,Miami Valley Hospital,1
1437,Michael E Debakey Va Medical Center,1
1438,Michigan Medicine University Of Michigan,1
1439,Milton S. Hershey Medical Center,1
1440,Mission Hospitals,1
1441,Moi Teaching And Referral Hospital,1
1442,Monash University Endocrine Surgery Unit,1
1443,Monmouth Medical Center,1
1444,Monroe Carell,1
1445,Montefiore Medical Center/Albert Einstien College Of Medicine,1
1446,Moores Cancer Center,1
1447,Morsani College Of Medicine,1
1448,Musc,1
1449,National Clinician Scholars Program,1
1450,Nationwide Childrens Hospital,1
1451,Naval Medical Center,1
1452,Nebraska Medical Center,1
1453,Nemour'S Children'S Hospital; University Of Central Florida,1
1454,Nemours Alfred I Dupot Hospital For Children,1
1455,Zucker School Of Medicine At Hofstra,1
