,smart_institution2,count
635,Johns Hopkins University School Of Public Health,2
636,Ann & Robert H. Lurie Childrens Hospital Of Chicago,2
637,Ann & Robert H Lurie Children'S Hospital Of Chicago,2
638,Coney Island Hospital,2
639,University Of Iowa Hospitals & Clinics,2
640,Louisiana State University Health Sciences Center - Shreveport,2
641,Toranomon Hospital,1
642,The Royal Wolverhampton Hospitals Nhs Trust,1
643,Vassar Brothers Medical Center,1
644,Thomas E. Starzl Transplantation Institute,1
645,Upstate Medical University,1
646,"Vilnius University Hospital ""Santaros Klinikos""",1
647,The Research Institute At Nationwide Children'S Hospital,1
648,The University Of North Carolina,1
649,Upmc,1
650,Upmc Children'S Hospital Of Pittsburgh,1
651,Vcu Medical Center,1
652,The Univeristy Of Texas Health Science Center At Houston,1
653,Virginai Tech Carilion School Of Medicine,1
654,Tokyo Metropolitan Cancer And Infectious Diseases Center Komagome Hospital,1
655,Veterans Affair Medical Center,1
656,Veterans Affairs Medical Center,1
657,Veterans Affairs New Jersey Health Care System,1
658,Tokyo Medical University Hospital,1
659,The University Of Tokyo,1
660,Thomas E. Starzl Transplantation Institure,1
661,The University Of Texas Md Anderson Cancer Center,1
662,Utmb,1
663,Utrgv School Of Medicine,1
664,The University Of Texas Rio Grande Valley,1
665,The Ohio State University Wexner Medical Center And Ross Heart Hospital,1
666,The University Of Texas Medical Branch At Galveston,1
667,The University Of Texas Medical Branch,1
668,Ut Houston-Memorial Hermann,1
669,The University Of Toledo College Of Medicine,1
670,The University Of Toledo Medical Center,1
671,Uvm Medical Center,1
672,The University Of Vermont Medical Center,1
673,Ut Health San Antonio,1
674,The University Of Oklahoma,1
675,Va Hsr&D Center For Innovations In Quality,1
676,Va New Jersey Healthcare System,1
677,Usc,1
678,Va North Texas Health Care System,1
679,Uthsc Com Chattanooga,1
680,Valley Health System,1
681,Upstate University Hospital- Downtown Campus,1
682,The University Of Sydney,1
683,The University Of Oklahoma School Of Community Medicine,1
684,Valley Heart And Vascular Institute,1
685,The Warren Alpert Medical School Of Brown University,1
686,Virginia Commonwealth University Health System,1
687,Weill Cornell Medicine,1
688,Virginia Commonwealth University Medical Center,1
689,Wolfson Children'S Hospital,1
690,Texas Tech Health Sciences Center,1
691,Winship Cancer Institute,1
692,Willis-Knighton Medical Center,1
693,William S. Middleton Va Memorial Hospital,1
694,William Beaumont Hospital,1
695,White River Junction Va Medical Center,1
696,Texas Tech University Health Sciences Center At El Paso,1
697,Western Michigan Universty Homer Stryker Md School Of Medicine,1
698,Texas Tech University Health Sciences Center In El Paso,1
699,Texas Tech University Health Sciences Center In El Paso Paul L. Foster School Of Medicine,1
700,Texas Tech University School Of Medicine,1
701,The Aga Khan University Hospital,1
702,The Aga Khan University Hospital Karachi,1
703,The Alfred,1
704,Western Michigan Homer Stryker School Of Medicine,1
705,Texas Tech Health Science Center School Of Medicine,1
706,Women And Childrens Hospital Of Buffalo,1
707,The Austin Hospital,1
708,World Health Organization,1
709,Teikyo University Hospital Trauma And Resuscitation Center,1
710,Zhongshsn Hospital Of Fudan University,1
711,Temple University Health System,1
712,Zhongshan Hospital Of Fudan University,1
713,Temple University School Of Medicine,1
714,Ysbyty Gwynedd Hospital,1
715,Tetteh Quarshie Memorial Hospital,1
716,Yokohama City University Medical Center,1
717,Texas A&M University,1
718,Yokohama City University,1
719,Yale School Of Public Health,1
720,Yale New Haven Health,1
721,Texas Childrens Hospital - Fetal Center,1
722,Xijing Hosiptal,1
723,Xi'An Jiaotong University Second Affiliated Hospital,1
724,The American British Cowdray Medical Center,1
725,The Brookdale Hospital And Medical Center,1
726,Virginia Hospital Center,1
727,Washington University In St. Louis School Of Medicine,1
728,The Medical Center Navicent Health,1
729,Walter Reed Army Medical Center,1
730,The Miriam Hospital In Rhode Island,1
731,Wakemed Health & Hospitals,1
732,Wake Forest University,1
733,Wake Forest School Of Medicine,1
734,Wake Forest Baptist Health,1
735,Wakamatsu Hospital Of University Of Occupational And Environmental Health,1
736,The Ohio State University Medical Center,1
737,Virginia Tech Carilion School Of Medicine And Research Institute,1
738,Virginia Tech,1
739,The Ohio State University Wexner Medical Center And James Cancer Hospital,1
740,The Ohio State University Wexner Medical Center And James Cancer Hospital And Solove Research Institute,1
741,Virginia Polytechnic Institute And State University,1
742,The Ohio State University Wexner Medical Center And James Comprehensive Cancer Center,1
743,Washington University In Saint Louis,1
744,The Jike University School Of Medicine,1
745,Westchester Medical Center University Hospital,1
746,The Hospital Of The University Of Pennsylvania,1
747,The Burn Center,1
748,Westchester Medical Center / New York Medical College,1
749,West Virginia University/Charleston Division,1
750,West Haven Va Medical Center,1
751,West China School Of Medicine/West China Hospital,1
752,West China Hospital Of Sichuan University,1
753,The College Of Surgeons Of East,1
754,Wellstar Atlanta Medical Center,1
755,Wellspan York Hospital,1
756,Weill Cornell Medicine / New York Presbyterian Hospital,1
757,Unversity Of Kansas Medical Center,1
758,The Feinstein Institutes For Medical Research At Northwell Health,1
759,Weill Corenll Medicine,1
760,The First Affiliated Hospital Of China Medical University,1
761,The George Washington University,1
762,Toronto Western Hospital,1
763,University Of Colorado Anschutz Medical Center,1
764,Touro University,1
765,University Of Missouri - Kansas City School Of Medicine,1
766,University Of Nevada Las Vegas School Of Medicine,1
767,University Of Arizona College Of Medicine- Phoenix,1
768,University Of Nebraska Medical School,1
769,University Of Arizona Medical Center,1
770,University Of Nebraska,1
771,University Of Modena And Reggio Emilia,1
772,University Of Arkansas For Medical Science,1
773,University Of Mississippi Medical Center,1
774,University Of North Dakota School Of Medicine And Health Sciences,1
775,University Of Michigan Medical Center,1
776,University Of Miami/Holy Cross Health,1
777,University Of Miami-Miller School Of Medicine,1
778,University Of Miami- Miller School Of Medicine,1
779,University Of California - Berkeley,1
780,University Of California - Berkeley / University Of California - San Francisco,1
781,University Of Miami Miller School Of Medicine/ Jackson Memorial Hospital,1
782,University Of Nigeria,1
783,University Of Oklahoma,1
784,University Of Medicine 1,1
785,University Of Pennsylvania Perelman School Of Medicine,1
786,University Of Abuja-Teaching Hospital,1
787,University Of Rochester Medical Center - Strong Memorial Hospital,1
788,University Of Port Harcourt,1
789,University Of Alabama - Birmingham,1
790,University Of Pittsburg Medical Center,1
791,University Of Pennsylvania School Of Medicine,1
792,University Of Alabama At Birmingham Department Of Surgery,1
793,University Of Alabama At Birmingham Heersink School Of Medicine,1
794,University Of Oklahoma - Tulsa,1
795,University Of Alabama At Birmingham Medical Center,1
796,University Of Pennsylvania Health System,1
797,University Of Pennsylvania - Perelman School Of Medicine,1
798,University Of Pennsvlvania,1
799,University Of Oxford,1
800,University Of Alabama-Birmingham,1
801,University Of Oklahoma School Of Community Medicine,1
802,University Of Miami Miller School Of Medicine - Holy Cross,1
803,University Of Massachusetts,1
804,University Of Rochester School Of Medicine & Dentistry,1
805,University Of Connecticut School Of Medicine,1
806,University Of Florida Com-Jacksonville,1
807,University Of Florida College Of Medicine - Gainesville,1
808,University Of Central Florida/Hca Consortium Ocala,1
809,University Of Flordia College Of Medicine,1
810,University Of Central Florida/Hospital Corporation Of America,1
811,University Of Delaware,1
812,University Of Chicago Medicine,1
813,University Of Connecticut,1
814,University Of Florida Health,1
815,University Of Colorado School Of Medicne,1
816,University Of Cincinnati College Of Medicine,1
817,University Of Cincinnati Medical College,1
818,University Of Cincinnati Medical School,1
819,University Of Colorado School Of Medicine - Children'S Hospital Colorado,1
820,University Of Colorado - Denver,1
821,University Of Colorado Anschtuz Medical Campus,1
822,University Of California San Francsco - East Bay,1
823,University Of Florida Jacksonville,1
824,University Of Maryland R A Cowley Shock Trauma Center,1
825,University Of Incarnate Word,1
826,University Of Manitoba,1
827,University Of Lagos,1
828,University Of Kwazulu-Natal,1
829,University Of Kansas School Of Medicine,1
830,University Of Kansas Health System,1
831,University Of California - San Francisco ,1
832,Tecnolgico De Monterrey,1
833,University Of Illinois College Of Medicine At Peoria,1
834,University Of Florida School Of Medicine,1
835,University Of California Davis Medical Center,1
836,University Of California Irvine,1
837,University Of Illinois College Of Medicine - Peoria,1
838,University Of California Riverside,1
839,University Of Houston,1
840,University Of Health Sciences Of Porto Alegre,1
841,University Of Global Health Equity,1
842,University Hospitials,1
843,University Of Rochester School Of Medicine And Dentistry,1
844,University Southern California,1
845,Uf Health Shands Hospital,1
846,University Of Vermont,1
847,University Of Utah Health Sciences,1
848,Ucla And Harbor-Ucla,1
849,Ucla Fielding School Of Public Health,1
850,Ucsf,1
851,Ucsf Fresno,1
852,University Of The Incarnate Word School Of Osteopathic Medicine,1
853,Umass Chan Medical School- Baystate,1
854,Uc San Diego,1
855,Umass Chan Medical School-Baystate,1
856,Unc,1
857,University Of The Incarnate Word,1
858,University Of Texas Southwestern Medical Center At Dallas,1
859,Uniformed Services University Of The Health Sciences & The Walter Reed National Military Medical Center,1
860,University Of Texas Southwestern - Austin,1
861,Uniformed Services University Of The Health Sciences And Walter Reed National Military Medical Center,1
862,University Of Vermont Larner College Of Medicine,1
863,Uab School Of Medicine,1
864,Univeristy Of Virginia,1
865,University Of Wiscosin,1
866,Transplant Center,1
867,Trinity College Dublin,1
868,Tripler Army Medical Center,1
869,Tsinghua University,1
870,University Radiology At Robert Wood Johnson,1
871,Tufts University,1
872,Tufts University Medical School,1
873,University Of Wisconsin-Hospital & Clinics,1
874,Uab Heersink School Of Medicine,1
875,Tufts University School Of Medicine - Maine Medical Center,1
876,University Of Wisconsin Madison School Of Medicine And Public Health,1
877,Tufts University School Of Medicine-Maine Medical Center,1
878,Tulane University,1
879,University Of Wisconsin Hospital And Clinics,1
880,University Of Wisconsin - Madison,1
881,University Of Wi School Of Medicine And Public Health,1
882,University Of Texas Rio Grande Valley School Of Medicine/ Ut Health Rio Grande Valley,1
883,University Of Texas Rio Grande Valley,1
884,University Of Sao Paulo,1
885,University Hospital Galway,1
886,University Of Tennessee Knoxville,1
887,University Of Tennessee Health Science Center (Uthsc),1
888,University Of Tennessee At Chattanooga,1
889,University Health Network,1
890,University Of Tennessee,1
891,University Of Tennesse Health Sciences,1
892,University Of Szeged,1
893,University Of South Dakota,1
894,University Cheikh Anta Diop And Grand Yoff General Hospital,1
895,University Hospital Ibn Sina Um5,1
896,University Hospital Limerick,1
897,University Of South Carolina,1
898,University Hospital Zurich,1
899,University Hospitals,1
900,University Of South Alabama Medical Center,1
901,University Of South Alabama College Of Medicine,1
902,University College Hospital Galway,1
903,University At Buffalo School Of Medicine And Biomedical Sciences,1
904,University Of Texas Medical School At Houston,1
905,Universidade De S&Atilde;O Paulo,1
906,Universidad Catlica Argentina,1
907,Universidad Ces,1
908,Universidad De Antioquia,1
909,Universidad De La Sabana,1
910,Universidad Industrial De Santander,1
911,Universidad Nacional De Trujillo,1
912,Universidad Peruana Cayetano Heredia,1
913,Universidade De So Paulo,1
914,University Of Tennessee Medical Canter At Knoxville,1
915,University Of Texas Health San Antonio,1
916,University Of Texas Austin Dell Medical School,1
917,Universit Catholique De Louvain,1
918,Universitt Catholique De Louvain,1
919,University Of Texas At Austin Dell Medical School,1
920,University Of Texas At Austin,1
921,University Of Tennessee Medical Center - Knoxville,1
922, Vilnius University,1
923,Ouhsc,1
924,Tawam Hospital,1
925,Feinstein Institutes For Medical Research,1
926,Emory University Hospital,1
927,Emory University Rollins School Of Public Health,1
928,Emory Univesity School Of Medicine,1
929,Epsom And St Helier University Hospitals Nhs Trust,1
930,Faculdade De Medicina Da Universidade Federal De Minas Gerais,1
931,Faculty Of Health Sciences,1
932,Faculty Of Medical Sciences,1
933,Faculty Of Medicine,1
934,Federal Ministry Of Health,1
935,Federal University Of Health Sciences Of Porto Alegre (Ufcspa),1
936,Federal University Of Parana,1
937,Federal University Of Rio Grande Do Norte (Ufrn),1
938,Feinstein Institute For Molecular Medicine,1
939,Feinstein Institute Of Medical Research,1
940,Firefighter'S Burn And Surgical Research Laboratory,1
941,Global Surgery Student Alliance (Gssa),1
942,Firefighters' Burn And Surgical Research Laboratory,1
943,First Affiliated Hospital Of China Medical University,1
944,Florida International University,1
945,Forbes Regional Hospital,1
946,Fordham University,1
947,Frank H. Netter Md School Of Medicine,1
948,Froedtert Hospital,1
949,Froedtert Memorial Lutheran Hospital,1
950,Fukushima Medical University School Of Medicine,1
951,Fuwai Hospital,1
952,Galway Clinic,1
953,Geisinger Surgery Institute,1
954,General University Hospital Gregorio Maran,1
955,George Mason University,1
956,Emergency & Critical Care Medicine,1
957,Elmhurst Hospital Center,1
958,Elmezzi Graduate School Of Molecular Medicine,1
959,Elective Medical Student,1
960,Dartmouth Hitchcock,1
961,Dartmouth-Hitchcock,1
962,Dartmouth-Hitchock Medical Center,1
963,David Geffen School Of Medicine At University Of California Los Angeles,1
964,Dayanand Medical College & Hospital,1
965,Denis And Lenora Foretia Foundation,1
966,Department Of Cardiovascular Surgery,1
967,Department Of Hepatobiliary Surgery And Institute Of Advanced Surgical Technology And Engineering,1
968,Department Of Pediatric Surgery,1
969,Department Of Plastic And Reconstructive Surgery,1
970,Department Of Surgery Harvard Medical School,1
971,Department Of Veterans Affairs Medical Center,1
972,Dept. Of Otorhinolaryngology,1
973,Derby Hospitals Nhs Foundation Trust,1
974,Division Of Child And Adolescent Health,1
975,Division Of Surgical Oncology,1
976,Divisions Of Pediatric Surgery And Surgical Research,1
977,Donald & Barbara Zucker School Of Medicine At Hofstra/Northwell,1
978,Drexel University/Hahnemann University Hospital,1
979,Durham Veterans Affairs Medical Center,1
980,East Carolina University,1
981,East Hospital,1
982,East Tennesse State University,1
983,East Tennessee State University - Quillen College Of Medicine,1
984,East Texas Medical Center,1
985,Edward Via College Of Osteopathic Medicine,1
986,Einstein Healthcare Network,1
987,Einstein Medical Center,1
988,Einstein Medical Center Philadelphia,1
989,Georgetown University Law Center,1
990,Graduate Institute Of Anatomy And Cell Biology,1
991,Targeted And Biological Therapies Group,1
992,Institute For Health Policy And Innovation,1
993,Hospital Of Hope,1
994,Hospital Pedro De Bethancourt,1
995,"Hospital Universitario ""General Calixto-Garcia""",1
996,Houston Methodist Hospital And Research Institute,1
997,Houston Methodist Research Institute,1
998,Howard Hughes Medical Institute,1
999,Howard University,1
1000,Hunter Medical Research Institute,1
1001,Hunter New England Health,1
1002,Huntington Hospital/Northwell Health,1
1003,Huntsman Cancer Institute At The University Of Utah,1
1004,Ichihara Hospital,1
1005,Imperial College,1
1006,Imperial College Healthcare Nhs Trust,1
1007,Institute Of Clinical Medicine,1
1008,Grady Hospital,1
1009,Instituto Nacional De Cancerologa,1
1010,Instituto Nacional De Cancerologia,1
1011,Instituto Tecnolgico Y De Estudios Superiores De Monterrey,1
1012,Intermountain Primary Children'S Hospital,1
1013,Iu School Of Medicine,1
1014,Jacobs School Of Medicine And Biomedical Sciences,1
1015,Jamaica Hospital Medical Center,1
1016,James Cook University,1
1017,James Madison University,1
1018,Japanese Red Cross Maebashi Hospital,1
1019,Jawaharlal Institute Of Postgraduate Medical Education And Research,1
1020,Jellison Cancer Institute/ Florida State University College Of Medicine,1
1021,Jesse Brown Va Medical Center,1
1022,Joe Dimaggio Children'S Hospital,1
1023,Hospital Jose Maria Cabral Y Baez,1
1024,Hospital Erasto Gaertner - Federal University Of Parana,1
1025,Hospital Episcopal San Lucas,1
1026,Hospital Das Clnicas Da Universidade Federal De Minas Gerais,1
1027,Grant Medical Center/Ohio University Heritage College Of Medicine,1
1028,Great Ormond Street Institute Of Child Health,1
1029,Griffith University,1
1030,Groote Schuur Hospital,1
1031,Guangdong Hospital Of Traditional Chinese Medicine,1
1032,Gundersen Health System,1
1033,Guobin Chen,1
1034,Guthrie / Robert Packer Hospital,1
1035,Guy'S & St Thomas' Nhs Foundation Trust,1
1036,Hadassah-Hebrew University Medical Center,1
1037,Hahnemann University Hospital,1
1038,Hahnemann University Hospital/Drexel University College Of Medicine,1
1039,Harbor- Ucla,1
1040,Harlem Hospital,1
1041,Harvard Beth Israel Deaconess Medical Center,1
1042,Harvard Medical School And Harvard T. H. Chan School Of Public Health. Brigham And Women'S Hospital,1
1043,Harvard Medical School. Brigham And Women'S Hospital,1
1044,Harvard T.H. Chan School Of Public Health,1
1045,Hatton Research Institute,1
1046,Hca,1
1047,Hca Healthcare/Usf Morsani College Of Medicine Gme,1
1048,Hca/Usf/Regional Medical Center Bayonet Point,1
1049,Hepatobiliary And Pancreatic Unit Hospital Pablo Tob=N Uribe (Hptu) ,1
1050,Highland Hospital,1
1051,Hofstra-Northwell School Of Medicine,1
1052,Hoftstra Northwell School Of Medicine,1
1053,Hokkaido University,1
1054,Honorary,1
1055,Hornepayne General Hospital,1
1056,Dartmouth Cancer Center,1
1057,Dalhousie University,1
1058,Cuny School Of Medicine,1
1059,Baylor Univeristy Medical Center,1
1060,Augusa State University,1
1061,Augusta University At The Medical College Of Georgia,1
1062,Austin Hospital,1
1063,Banner University Medical Center - Tucson - Banner Health,1
1064,Banner University Medical Center- Phoenix,1
1065,Banner University Medical Center/ University Of Arizona,1
1066,Banner- University Of Arizona,1
1067,Banner- University Of Arizona Medical Center,1
1068,Banner-University Of Arizona,1
1069,Bassett Medical Center,1
1070,Baylor College Of Medicine / Michael E. Debakey Va Medical Center,1
1071,Baylor College Of Medicine And Texas Childrens Hospital,1
1072,Baylor Scott & White Medical Center-Temple,1
1073,Baylor St. Lukes Medical Center,1
1074,Baylor University Medical Center,1
1075,Crozer-Keystone Medical Center,1
1076,Beaumont Health,1
1077,Beth Israel Deconess Medical Center,1
1078,Beth Israel Lahey Hospital,1
1079,Bethany Kids At Aic Kijabe Hospital,1
1080,Biolife4D,1
1081,Birmingham Va Medical Center,1
1082,Boston University Medical Center,1
1083,Brigham Young University,1
1084,Brighton And Sussex University Hospitals Nhs Trust,1
1085,Bronx Care (Lebanon) Hospital,1
1086,Bronx- Lebanon Hospital Center,1
1087,Brooklyn Hospital Center,1
1088,Brookwood Baptist Health System,1
1089,Broward Health,1
1090,Auckland City Hospital,1
1091,Atrium Health Wake Forest Baptist Health,1
1092,Atrium Health Navicent,1
1093,Ascension St. Vincent Hospital,1
1094,A T Still University,1
1095,A.T. Still University,1
1096,Abilene Christian University,1
1097,Abington Hospital,1
1098,Academic Medical Center,1
1099,Addenbrookes Hospital,1
1100,Addis Ababa University,1
1101,Advent Health Orlando,1
1102,Adventhealth Cancer Institute,1
1103,Advocate Lutheran General Hospital,1
1104,Affiliated Zhongda Hospital,1
1105,Aga Khan University Hospital Karachi,1
1106,Air Force Institute Of Technology,1
1107,Akron General Medical Center,1
1108,Albert Einstein College Of Medicine / Montefiore Medical Center,1
1109,Albert Einstein College Of Medicine And Montefiore Medical Center,1
1110,Alfred Health,1
1111,Allegheny Health Network,1
1112,Alpert Medical School Of Brown University,1
1113,American Academy Of Pediatrics Section On Surgey,1
1114,Amsterdamumc,1
1115,An-Najah University,1
1116,Ankara University Faculty Of Medicine,1
1117,Ankara Yildirim Beyazit University,1
1118,Ann And Robert H. Lurie Children'S Hospital,1
1119,Arnot Ogden Medical Center,1
1120,Asahi General Hospital,1
1121,Ascension Providence,1
1122,Ascension Saint Agnes Healthcare,1
1123,Brown University - Rhode Island Hospital,1
1124,Brown University / Rhode Island Hospital,1
1125,Brown University Medical School/Rhode Island Hospital,1
1126,Children'S Medical Center Dallas,1
1127,Children'S Mercy Hospital-University Of Missouri Kansas City,1
1128,Children'S Mercy Kansas City,1
1129,Children'S National Health System,1
1130,Children'S National Medical Center,1
1131,Childrens Hospital Colorado/University Of Colorado School Of Medicine,1
1132,Childrens Hospital Of Los Angeles,1
1133,Childrens Hospital Of Pittsburgh Of Upmc,1
1134,Chittagong Medical College Hospital,1
1135,Christian Medical College,1
1136,Cinch Valley Medical Center,1
1137,Cincinnati Children'S Hospital Medical Center (Cchmc),1
1138,Cincinnati Childrens Hospital And Medical Center,1
1139,Cincinnati Childrens'S Hospital Medical Center,1
1140,City Of Hope Comprehensive Cancer Center,1
1141,City University Of New York,1
1142,Clement J Zablocki Veterans Affairs Medical Center,1
1143,Cmc Hospital,1
1144,Cohen Children'S Hospital,1
1145,Cold Spring Harbor Laboratory,1
1146,College Of Medicine And Allied Health Sciences,1
1147,Columbia University Irving Medical Center,1
1148,Companeros En Salud,1
1149,Concord Hospital,1
1150,Consulente Policlinico San Pietro,1
1151,Cook County Health,1
1152,Cook County Health And Hospitals System,1
1153,Copenhagen University Hospital,1
1154,Creighton University,1
1155,Crown Princess Mary Cancer Centre,1
1156,Children'S Mercy Hospital And Clinics,1
1157,Children'S Hospital Of Pittsburgh,1
1158,C.S. Mott Children'S Hospital,1
1159,Children'S Hospital Of Michigan,1
1160,C.S.Mott Children'S Hospital,1
1161,California Northstate University College Of Medicine,1
1162,California Northstate University College Of Pharmacy,1
1163,Cambridge University Medical School,1
1164,Cancer Institute Hospital,1
1165,Cardinal Glennon Children'S Hospital,1
1166,Cardinal Glennon Childrens Medical Center,1
1167,Cardiovascular Outcomes Research Laboratories (Corelab) At University Of California,1
1168,Carle Foundation Hospital,1
1169,Carnegie Mellon University,1
1170,Carolinas Healthcare System,1
1171,Cedars-Sinai,1
1172,Center For Fetal And Placental Research,1
1173,Center For Global Surgical Studies,1
1174,Center For Innovations In Quality,1
1175,Center For Perinatal Research,1
1176,Center For Translational Injury Research,1
1177,Center Of Advanced Surgical Oncology,1
1178,Centre For Biomedical Technologies,1
1179,Centre Hospitalier De L'Universit De Montral,1
1180,Centro Mtdico Abc,1
1181,Chandler Regional Medical Center,1
1182,Chang Gung Memorial Hospital,1
1183,Chicago Medical School - Rosalind Franklin University Of Medicine And Science,1
1184,Chicago Medical School At Rosalind Franklin University,1
1185,Children Mercy'S Hospital,1
1186,Children'S Hospital At Oklahoma University Medicine,1
1187,Children'S Hospital Los Angeles/The Saban Research Institute,1
1188,Children'S Hospital Of Los Angeles,1
1189,John D. Dingell Va Medical Center,1
1190,John H Stroger Jr Hospital Of Cook County,1
1191,John Wayne Cancer Institute/Providence St. John'S Medical Center,1
1192,Rady Children'S Hospital - San Diego,1
1193,Price Institue Of Surgical Research,1
1194,Price Institute Of Of Surgical Research And The Section Of Colorectal Surgery,1
1195,Price Institute Of Surgical Research And The Section Of Colorectal Surgery,1
1196,Primary Childrens Hospital,1
1197,Prince Of Wales Hospital,1
1198,Pritzker School Of Medicine At The University Of Chicago,1
1199,Program In Global Surgery And Social Change-Harvard Medical School,1
1200,Qassim University,1
1201,Queen Elizabeth Central Hospital,1
1202,Queen Elizabeth University Hospital,1
1203,Queen Mary,1
1204,R Adams Cowley Shock Trauma Center,1
1205,Rabin Medical Center,1
1206,Rady Children'S Hospital,1
1207,Rady Children'S Hospital/ Uc San Diego,1
1208,Nyu Winthrop Hospital,1
1209,Red Duke Trauma Institute,1
1210,Richmond Hill Urology And Prostate Institute,1
1211,Richmond Hill Urology Practice & Prostate Institute,1
1212,Rigshospitalet,1
1213,Riverside University Health System,1
1214,Robert H. Lurie Comprehensive Cancer Center,1
1215,Rocky Vista University,1
1216,Rosalind Franklin University Of Medicine And Science,1
1217,Royal Free Hospital Nhs Foundation Trust,1
1218,Royal Prince Alfred Hospital,1
1219,Russells Hall Hospital,1
1220,Rutgers - New Jersey Medical School,1
1221,Rutgers - Njms,1
1222,Rutgers - Robert Wood Johnson Medical School,1
1223,Pontificia Universidad Javeriana - Hospital Universitario San Ignacio,1
1224,Plastic And Reconstructive Surgery Department,1
1225,Physis Group,1
